{
  "$schema": "https://json-schema.org/draft/2020-12/schema",
  "$id": "https://example.invalid/steuerboard/schemas/runbook-result.v1.schema.json",
  "title": "runbook-result.v1",
  "type": "object",
  "required": [
    "schema_version",
    "result_id",
    "runbook_ref",
    "runbook_kind",
    "status",
    "started_at",
    "finished_at",
    "repo_path",
    "short_assessment",
    "steps",
    "evidence_paths",
    "source_refs",
    "redaction_verified",
    "boundary"
  ],
  "additionalProperties": false,
  "properties": {
    "schema_version": {
      "type": "string",
      "const": "runbook-result.v1"
    },
    "result_id": {
      "type": "string",
      "minLength": 1
    },
    "runbook_ref": {
      "type": "string",
      "minLength": 1
    },
    "runbook_kind": {
      "type": "string",
      "enum": [
        "repo-sync-gate",
        "dns-gate",
        "ssh-gate",
        "tailscale-preflight",
        "server-facts-snapshot",
        "heimserver-service-gate"
      ]
    },
    "status": {
      "type": "string",
      "enum": [
        "passed",
        "blocked",
        "inconclusive"
      ]
    },
    "started_at": {
      "type": "string",
      "pattern": "^\\d{4}-\\d{2}-\\d{2}T\\d{2}:\\d{2}:\\d{2}Z$"
    },
    "finished_at": {
      "type": "string",
      "pattern": "^\\d{4}-\\d{2}-\\d{2}T\\d{2}:\\d{2}:\\d{2}Z$"
    },
    "repo_path": {
      "type": "string",
      "minLength": 1
    },
    "short_assessment": {
      "type": "string"
    },
    "steps": {
      "type": "array",
      "items": {
        "type": "object",
        "required": [
          "step_id",
          "label",
          "status"
        ],
        "additionalProperties": false,
        "properties": {
          "step_id": {
            "type": "string",
            "minLength": 1
          },
          "label": {
            "type": "string",
            "minLength": 1
          },
          "status": {
            "type": "string",
            "enum": [
              "passed",
              "blocked",
              "inconclusive"
            ]
          },
          "source_ref": {
            "type": "string"
          },
          "evidence_path": {
            "type": "string"
          }
        }
      }
    },
    "evidence_paths": {
      "type": "array",
      "items": {
        "type": "string"
      }
    },
    "source_refs": {
      "type": "array",
      "items": {
        "type": "string"
      }
    },
    "redaction_verified": {
      "type": "boolean"
    },
    "boundary": {
      "type": "object",
      "required": [
        "does_not_execute_mutating_actions",
        "does_not_mutate",
        "does_not_authorise_actions",
        "read_only_or_dry_run_only"
      ],
      "additionalProperties": false,
      "properties": {
        "does_not_execute_mutating_actions": {
          "type": "boolean",
          "const": true
        },
        "does_not_mutate": {
          "type": "boolean",
          "const": true
        },
        "does_not_authorise_actions": {
          "type": "boolean",
          "const": true
        },
        "read_only_or_dry_run_only": {
          "type": "boolean",
          "const": true
        }
      }
    }
  }
}
