{
  "schema_version": "runbook-result.v1",
  "result_id": "rbresult-tailscale-preflight-20260601-blocked-001",
  "runbook_ref": "runbook-tailscale-preflight-20260601-001",
  "runbook_kind": "tailscale-preflight",
  "status": "blocked",
  "started_at": "2026-06-01T10:00:01Z",
  "finished_at": "2026-06-01T10:00:02Z",
  "repo_path": "/home/alex/repos/steuerboard",
  "short_assessment": "Tailscale-preflight blocked. Required checks blocked=['tailscale-heimserver-ssh']. One or more configured overlay targets were not locally reachable or resolvable.",
  "steps": [
    {
      "step_id": "step-tailscale-check-001",
      "label": "Tailscale-preflight check 'tailscale-heimserver-ssh': host='heimserver.tailnet.example.invalid', observed_ips=['192.168.178.62'], expected_ip_prefixes=['100.64.0.0/10'], expected_ip_values=[], port=22, timeout_seconds=2.0, required=True, reason_code=tailscale_expected_prefix_mismatch",
      "status": "blocked",
      "source_ref": "local overlay reachability"
    }
  ],
  "evidence_paths": [
    "examples/runbook-traces/tailscale-preflight-blocked-trace.jsonl"
  ],
  "source_refs": [
    "runbook-model.v1",
    "local overlay reachability"
  ],
  "redaction_verified": true,
  "boundary": {
    "does_not_execute_mutating_actions": true,
    "does_not_mutate": true,
    "does_not_authorise_actions": true,
    "read_only_or_dry_run_only": true
  }
}
