{
  "schema_version": "runbook-result.v1",
  "result_id": "rbresult-tailscale-preflight-20260601-passed-001",
  "runbook_ref": "runbook-tailscale-preflight-20260601-001",
  "runbook_kind": "tailscale-preflight",
  "status": "passed",
  "started_at": "2026-06-01T10:00:01Z",
  "finished_at": "2026-06-01T10:00:02Z",
  "repo_path": "/home/alex/repos/steuerboard",
  "short_assessment": "Tailscale-preflight passed. Required checks passed=['tailscale-heimserver-ssh']. This is local overlay reachability at check time, not proof that Tailscale is correctly authenticated or configured.",
  "steps": [
    {
      "step_id": "step-tailscale-check-001",
      "label": "Tailscale-preflight check 'tailscale-heimserver-ssh': host='heimserver.tailnet.example.invalid', required=True, reason_code=tailscale_tcp_connect_succeeded",
      "status": "passed",
      "source_ref": "local overlay reachability"
    }
  ],
  "evidence_paths": [
    "examples/runbook-traces/tailscale-preflight-passed-trace.jsonl"
  ],
  "source_refs": [
    "runbook-model.v1",
    "local overlay reachability"
  ],
  "redaction_verified": true,
  "boundary": {
    "does_not_execute_mutating_actions": true,
    "does_not_mutate": true,
    "does_not_authorise_actions": true,
    "read_only_or_dry_run_only": true
  }
}
